stop_id,stop_code,stop_name,stop_desc,stop_lat,stop_lon,agency_id,jurisdiction_id,location_type,parent_station,relative_position,cardinal_direction,wheelchair_boarding,primary_street,address_range,cross_location
9582,9582,N Bird at Windsor,This stop (#9582) is southbound on the 298 block of N Bird after Windsor,43.18718,-89.226435,MMT,CSUN,0,,1,180,1,N Bird,298,Windsor
9584,9584,Eastpark at W Terrace,This stop (#9584) is westbound on the 5098 block of Eastpark after W Terrace,43.144437,-89.2955,MMT,CMAD,0,,1,270,1,Eastpark,5098,W Terrace
9586,9586,N Grand at Windsor,This stop (#9586) is southbound on the 598 block of N Grand after Windsor,43.18664,-89.264657,MMT,CSUN,0,,1,180,1,N Grand,598,Windsor
9587,9587,E Washington at Portage,This stop (#9587) is eastbound on the 4101 block of E Washington after Portage,43.123735,-89.313995,MMT,CMAD,0,,1,90,1,E Washington,4101,Portage
9588,9588,E Washington at Independence,This stop (#9588) is westbound on the 4498 block of E Washington after Independence,43.127957,-89.308713,MMT,CMAD,0,,1,270,1,E Washington,4498,Independence
9591,9591,Commercial at Redland,This stop (#9591) is eastbound on the 4399 block of Commercial before Redland,43.106564,-89.305043,MMT,CMAD,0,,3,90,1,Commercial,4399,Redland
9618,9618,Independence at Melody,This stop (#9618) is southbound on the 2398 block of Independence after Melody,43.13025,-89.310241,MMT,CMAD,0,,1,180,1,Independence,2398,Melody
9621,9621,O'Keeffe at Brown Bear,This stop (#9621) is eastbound on the 1299 block of O'Keeffe before Brown Bear,43.164942,-89.255634,MMT,CSUN,0,,3,90,1,O'Keeffe,1299,Brown Bear
9629,9629,Nakoosa at Commercial,This stop (#9629) is eastbound on the 4101 block of Nakoosa after Commercial,43.10838,-89.314377,MMT,CMAD,0,,1,90,1,Nakoosa,4101,Commercial
9633,9633,Hayes at Portage,This stop (#9633) is eastbound on the 4601 block of Hayes after Portage,43.14254,-89.305995,MMT,CMAD,0,,1,90,1,Hayes,4601,Portage
9636,9636,N Thompson at Oak Valley,This stop (#9636) is southbound on the 1200 block of N Thompson before Oak Valley,43.11593,-89.296467,MMT,CMAD,0,,3,180,1,N Thompson,1200,Oak Valley
9637,9637,S Grand at Prairie Lakes,This stop (#9637) is northbound on the 1199 block of S Grand after Prairie Lakes,43.166346,-89.268709,MMT,CSUN,0,,1,0,1,S Grand,1199,Prairie Lakes
9642,9642,Wright at Straubel,This stop (#9642) is southbound on the 1598 block of Wright before Straubel,43.117167,-89.330718,MMT,CMAD,0,,3,180,1,Wright,1598,Straubel
9645,9645,N Thompson at Oak Valley,This stop (#9645) is northbound on the 1201 block of N Thompson after Oak Valley,43.116154,-89.296343,MMT,CMAD,0,,1,0,1,N Thompson,1201,Oak Valley
9648,9648,Tower at Grandview,This stop (#9648) is westbound on the 100 block of Tower after Grandview,43.197002,-89.214325,MMT,CSUN,0,,1,270,1,Tower,100,Grandview
9650,9650,W Main at Ruby,This stop (#9650) is westbound on the 1200 block of W Main after Ruby,43.180098,-89.233256,MMT,CSUN,0,,1,270,1,W Main,1200,Ruby
9651,9651,Eastpark at U W Health,This stop (#9651) is eastbound on the 4651 block of Eastpark opposite U W Health,43.153513,-89.301094,MMT,CMAD,0,,4,90,1,Eastpark,4651,U W Health
9670,9670,Melody at Stuart,This stop (#9670) is westbound on the 4198 block of Melody after Stuart,43.130763,-89.312835,MMT,CMAD,0,,1,270,1,Melody,4198,Stuart
9673,9673,Wright at Anderson,This stop (#9673) is northbound on the 1699 block of Wright before Anderson,43.11988,-89.330295,MMT,CMAD,0,,3,0,1,Wright,1699,Anderson
9689,9689,E Main at S Bristol,This stop (#9689) is eastbound on the 101 block of E Main after S Bristol,43.183184,-89.213278,MMT,CSUN,0,,1,90,1,E Main,101,S Bristol
9690,9690,Darwin at Packers,This stop (#9690) is westbound on the 2100 block of Darwin before Packers,43.129037,-89.355054,MMT,CMAD,0,,3,270,1,Darwin,2100,Packers
9701,9701,High Crossing at E Springs,This stop (#9701) is eastbound on the 4801 block of High Crossing after E Springs,43.131985,-89.297648,MMT,CMAD,0,,1,90,1,High Crossing,4801,E Springs
9709,9709,N Bristol at Windsor,This stop (#9709) is northbound on the 301 block of N Bristol after Windsor,43.188018,-89.212423,MMT,CSUN,0,,1,0,1,N Bristol,301,Windsor
9715,9715,Portage at Village,This stop (#9715) is northbound on the 3699 block of Portage before Village,43.140501,-89.309248,MMT,CMAD,0,,3,0,1,Portage,3699,Village
9717,9717,Eastpark at Biltmore,This stop (#9717) is northbound on the 4698 block of Eastpark after Biltmore,43.152258,-89.298958,MMT,CMAD,0,,1,0,1,Eastpark,4698,Biltmore
9718,9718,N Bird at Summit,This stop (#9718) is southbound on the 798 block of N Bird after Summit,43.190878,-89.226165,MMT,CSUN,0,,1,180,1,N Bird,798,Summit
9719,9719,Eagan at Lien,This stop (#9719) is northbound on the 1701 block of Eagan after Lien,43.121258,-89.307155,MMT,CMAD,0,,1,0,1,Eagan,1701,Lien
9721,9721,W Main at Ruby,This stop (#9721) is eastbound on the 1199 block of W Main after Ruby,43.180106,-89.232452,MMT,CSUN,0,,1,90,1,W Main,1199,Ruby
9723,9723,Portage at Rieder,This stop (#9723) is northbound on the 3001 block of Portage after Rieder,43.135761,-89.31552,MMT,CMAD,0,,1,0,1,Portage,3001,Rieder
9725,9725,Kinsman at Wright,This stop (#9725) is eastbound on the 3501 block of Kinsman after Wright,43.125574,-89.329781,MMT,CMAD,0,,1,90,1,Kinsman,3501,Wright
9728,9728,N Grand at Blue Heron,This stop (#9728) is southbound on the 298 block of N Grand after Blue Heron,43.180964,-89.264942,MMT,CSUN,0,,1,180,1,N Grand,298,Blue Heron
9733,9733,Walsh at Commercial,This stop (#9733) is northbound on the 701 block of Walsh after Commercial,43.106989,-89.309872,MMT,CMAD,0,,1,0,1,Walsh,701,Commercial
9745,9745,N Thompson at Golden Leaf,This stop (#9745) is northbound on the 999 block of N Thompson after Golden Leaf,43.112151,-89.296054,MMT,CMAD,0,,1,0,1,N Thompson,999,Golden Leaf
9747,9747,Eastpark at E Terrace,This stop (#9747) is eastbound on the 5299 block of Eastpark after E Terrace,43.146341,-89.291492,MMT,CMAD,0,,1,90,1,Eastpark,5299,E Terrace
9753,9753,Nakoosa at Walmart,This stop (#9753) is eastbound on the 4141 block of Nakoosa opposite Walmart,43.109301,-89.312042,MMT,CMAD,0,,4,90,1,Nakoosa,4141,Walmart
9759,9759,Eagan at East Towne,This stop (#9759) is northbound on the 1751 block of Eagan after East Towne,43.12545,-89.309199,MMT,CMAD,0,,1,0,1,Eagan,1751,East Towne
9770,9770,N Thompson at Jana,This stop (#9770) is southbound on the 800 block of N Thompson before Jana,43.108743,-89.299049,MMT,CMAD,0,,3,180,1,N Thompson,800,Jana
9778,9778,Walsh at Commercial,This stop (#9778) is southbound on the 700 block of Walsh before Commercial,43.106855,-89.310181,MMT,CMAD,0,,3,180,1,Walsh,700,Commercial
9782,9782,O'Keeffe at Summerfield,This stop (#9782) is westbound on the 1098 block of O'Keeffe before Summerfield,43.168991,-89.25021,MMT,CSUN,0,,3,270,1,O'Keeffe,1098,Summerfield
9787,9787,Kinsman at N Stoughton,This stop (#9787) is eastbound on the 3647 block of Kinsman before N Stoughton,43.125518,-89.32726,MMT,CMAD,0,,3,90,1,Kinsman,3647,N Stoughton
9797,9797,Kinsman at Bartillon,This stop (#9797) is eastbound on the 3701 block of Kinsman before Bartillon,43.125507,-89.323307,MMT,CMAD,0,,3,90,1,Kinsman,3701,Bartillon
9810,9810,E Washington at Eagan,This stop (#9810) is westbound on the 4298 block of E Washington after Eagan,43.126428,-89.31089,MMT,CMAD,0,,1,270,1,E Washington,4298,Eagan
9812,9812,Nakoosa at Walmart,This stop (#9812) is westbound on the 4198 block of Nakoosa adjacent Walmart,43.109301,-89.312523,MMT,CMAD,0,,2,270,1,Nakoosa,4198,Walmart
9817,9817,International at Darwin,This stop (#9817) is northbound on the 3101 block of International after Darwin,43.129033,-89.348308,MMT,PRIV,0,,1,0,1,International,3101,Darwin
9822,9822,High Crossing at Cross Hill,This stop (#9822) is westbound on the 5498 block of High Crossing after Cross Hill,43.142716,-89.284728,MMT,CMAD,0,,1,270,1,High Crossing,5498,Cross Hill
9833,9833,N Bristol at Klubertanz,This stop (#9833) is northbound on the 1101 block of N Bristol after Klubertanz,43.195832,-89.210766,MMT,CSUN,0,,1,0,1,N Bristol,1101,Klubertanz
9837,9837,Shopko at Aberg,This stop (#9837) is northbound on the 2699 block of Shopko after Aberg,43.111179,-89.346808,MMT,CMAD,0,,1,0,1,Shopko,2699,Aberg
9844,9844,N Thompson at Commercial,This stop (#9844) is southbound on the 700 block of N Thompson before Commercial,43.107079,-89.300732,MMT,CMAD,0,,3,180,1,N Thompson,700,Commercial
9846,9846,E Washington at Zeier,This stop (#9846) is westbound on the 4698 block of E Washington after Zeier,43.129674,-89.306214,MMT,CMAD,0,,1,270,1,E Washington,4698,Zeier
9862,9862,O'Keeffe at Wild Iris,This stop (#9862) is southbound on the 1600 block of O'Keeffe before Wild Iris,43.15975,-89.263965,MMT,CSUN,0,,3,180,0,O'Keeffe,1600,Wild Iris
9870,9870,Anniversary at Forest Run,This stop (#9870) is westbound on the 4800 block of Anniversary after Forest Run,43.135329,-89.302523,MMT,CMAD,0,,1,270,0,Anniversary,4800,Forest Run
9879,9879,W Main at S Walker,This stop (#9879) is eastbound on the 1398 block of W Main after S Walker,43.179054,-89.236213,MMT,CSUN,0,,1,90,1,W Main,1398,S Walker
9892,9892,N Thompson at Mesta,This stop (#9892) is southbound on the 828 block of N Thompson before Mesta,43.109788,-89.296713,MMT,CMAD,0,,3,180,1,N Thompson,828,Mesta
9906,9906,Eastpark at E Terrace,This stop (#9906) is westbound on the 5298 block of Eastpark after E Terrace,43.145876,-89.291963,MMT,CMAD,0,,1,270,1,Eastpark,5298,E Terrace
9914,9914,Darwin at International,This stop (#9914) is westbound on the 2698 block of Darwin after International,43.128899,-89.349012,MMT,CMAD,0,,1,270,0,Darwin,2698,International
9918,9918,Kinsman at N Stoughton,This stop (#9918) is westbound on the 3698 block of Kinsman after N Stoughton,43.125876,-89.325889,MMT,CMAD,0,,1,270,1,Kinsman,3698,N Stoughton
9924,9924,N Bird at Tower,This stop (#9924) is southbound on the 1098 block of N Bird after Tower,43.196465,-89.225864,MMT,CSUN,0,,1,180,1,N Bird,1098,Tower
9931,9931,Park at Angell Park,This stop (#9931) is northbound on the 400 block of Park opposite Angell Park,43.180225,-89.21105,MMT,CSUN,0,,4,0,1,Park,400,Angell Park
9936,9936,Eastpark at Dreamer,This stop (#9936) is southbound on the 4801 block of Eastpark after Dreamer,43.147181,-89.299165,MMT,CMAD,0,,1,180,0,Eastpark,4801,Dreamer
9938,9938,Independence at Declaration,This stop (#9938) is southbound on the 2600 block of Independence before Declaration,43.132684,-89.307927,MMT,CMAD,0,,3,180,0,Independence,2600,Declaration
9939,9939,Portage at Tomscot,This stop (#9939) is northbound on the 3499 block of Portage before Tomscot,43.138392,-89.313094,MMT,CMAD,0,,3,0,1,Portage,3499,Tomscot
9946,9946,W Main at Clarmar,This stop (#9946) is westbound on the 1700 block of W Main after Clarmar,43.177791,-89.242028,MMT,CSUN,0,,1,270,1,W Main,1700,Clarmar
9951,9951,N Thompson at Sycamore,This stop (#9951) is northbound on the 1101 block of N Thompson after Sycamore,43.114166,-89.295951,MMT,CMAD,0,,1,0,1,N Thompson,1101,Sycamore
9952,9952,S Grand at Blue Aster,This stop (#9952) is southbound on the 600 block of S Grand after Blue Aster,43.17141,-89.265385,MMT,CSUN,0,,1,180,1,S Grand,600,Blue Aster
9955,9955,O'Keeffe at Prairie,This stop (#9955) is eastbound on the 851 block of O'Keeffe before Prairie,43.171146,-89.248202,MMT,CSUN,0,,3,90,1,O'Keeffe,851,Prairie
9967,9967,Walsh at Nakoosa,This stop (#9967) is northbound on the 899 block of Walsh before Nakoosa,43.110051,-89.309817,MMT,CMAD,0,,3,0,1,Walsh,899,Nakoosa
9996,9996,Eagan at East Towne,This stop (#9996) is southbound on the 1748 block of Eagan after East Towne,43.124886,-89.309002,MMT,CMAD,0,,1,180,1,Eagan,1748,East Towne
10000,C200,Regent at Capital High,This flag stop (#C200) is westbound on the 3800 block of Regent adjacent Capital High,43.068127,-89.439348,MTS,CMAD,0,,2,270,1,Regent,3800,Capital High
10099,C299,Regent at Capital High,This flag stop (#C299) is eastbound on the 3801 block of Regent opposite Capital High,43.067912,-89.439718,MTS,CMAD,0,,4,90,1,Regent,3801,Capital High
10100,E100,E Washington at East High,This flag stop (#E100) is westbound on the 2222 block of E Washington adjacent East High,43.096625,-89.353789,MTS,CMAD,0,,2,270,1,E Washington,2222,East High
11502,E502,Comanche at Shoshone,This flag stop (#E502) is southbound on the 5398 block of Comanche after Shoshone,43.15545,-89.373245,MTS,CMAD,0,,1,180,0,Comanche,5398,Shoshone
11506,E506,Delaware at N Sherman,This flag stop (#E506) is westbound on the 1698 block of Delaware after N Sherman,43.14283,-89.363455,MTS,CMAD,0,,1,270,0,Delaware,1698,N Sherman
11530,E530,Anhalt at Doe,This flag stop (#E530) is westbound on the 1900 block of Anhalt opposite Doe,43.142228,-89.359353,MTS,CMAD,0,,4,270,0,Anhalt,1900,Doe
11902,E902,Golden Leaf at N Thompson,This flag stop (#E902) is westbound on the 5100 block of Golden Leaf before N Thompson,43.11199,-89.295832,MTS,CMAD,0,,3,270,0,Golden Leaf,5100,N Thompson
11904,E904,Glacier Hill at Lien,This flag stop (#E904) is southbound on the 1598 block of Glacier Hill after Lien,43.120903,-89.291418,MTS,CMAD,0,,1,180,0,Glacier Hill,1598,Lien
11934,E934,Glacier Hill at Valley Edge,This flag stop (#E934) is southbound on the 1100 block of Glacier Hill before Valley Edge,43.114653,-89.290367,MTS,CMAD,0,,3,180,0,Glacier Hill,1100,Valley Edge
11949,E949,Sycamore at Wayridge,This flag stop (#E949) is eastbound on the 4801 block of Sycamore after Wayridge,43.113749,-89.299929,MTS,CMAD,0,,1,90,0,Sycamore,4801,Wayridge
11956,E956,Glacier Hill at Southridge,This flag stop (#E956) is southbound on the 1300 block of Glacier Hill before Southridge,43.117231,-89.289806,MTS,CMAD,0,,3,180,0,Glacier Hill,1300,Southridge
11958,E958,Sycamore at Wayridge,This flag stop (#E958) is westbound on the 4798 block of Sycamore after Wayridge,43.113928,-89.300609,MTS,CMAD,0,,1,270,0,Sycamore,4798,Wayridge
11961,E961,Mendota at Sycamore,This flag stop (#E961) is northbound on the 1100 block of Mendota after Sycamore,43.114056,-89.315049,MTS,CMAD,0,,1,0,0,Mendota,1100,Sycamore
11963,E963,Mendota at Duncan,This flag stop (#E963) is northbound on the 1300 block of Mendota opposite Duncan,43.116137,-89.317725,MTS,CMAD,0,,4,0,0,Mendota,1300,Duncan
11966,E966,Mendota at Hoover,This flag stop (#E966) is southbound on the 1401 block of Mendota before Hoover,43.117912,-89.320403,MTS,CMAD,0,,3,180,0,Mendota,1401,Hoover
11967,E967,Mendota at Hoover,This flag stop (#E967) is northbound on the 1400 block of Mendota opposite Hoover,43.117929,-89.320069,MTS,CMAD,0,,4,0,0,Mendota,1400,Hoover
11968,E968,Mendota at Duncan,This flag stop (#E968) is southbound on the 1301 block of Mendota before Duncan,43.116101,-89.318059,MTS,CMAD,0,,3,180,0,Mendota,1301,Duncan
11970,E970,Mendota at Sycamore,This flag stop (#E970) is southbound on the 1101 block of Mendota before Sycamore,43.113986,-89.315344,MTS,CMAD,0,,3,180,0,Mendota,1101,Sycamore
11973,E973,Lien at N Thompson,This flag stop (#E973) is eastbound on the 4801 block of Lien after N Thompson,43.121312,-89.297952,MTS,CMAD,0,,1,90,1,Lien,4801,N Thompson
11974,E974,Sycamore at N Thompson,This flag stop (#E974) is westbound on the 4998 block of Sycamore after N Thompson,43.113996,-89.296495,MTS,CMAD,0,,1,270,0,Sycamore,4998,N Thompson
11978,E978,Glacier Hill at Ridge Oak,This flag stop (#E978) is southbound on the 1400 block of Glacier Hill before Ridge Oak,43.119094,-89.291174,MTS,CMAD,0,,3,180,0,Glacier Hill,1400,Ridge Oak
11992,E992,Golden Leaf at Eagle Crest,This flag stop (#E992) is westbound on the 5298 block of Golden Leaf before Eagle Crest,43.11255,-89.291841,MTS,CMAD,0,,3,270,0,Golden Leaf,5298,Eagle Crest
113,F013,W Washington at Brittingham,This flag stop (#F013) is eastbound on the 801 block of W Washington adjacent Brittingham,43.06501,-89.397603,MTS,CMAD,0,,2,90,1,W Washington,801,Brittingham
516,F016,W Washington at Regent,This flag stop (#F016) is westbound on the 700 block of W Washington after Regent,43.066711,-89.395874,MTS,CMAD,0,,1,270,1,W Washington,700,Regent
225,F025,W Washington at Park View,This flag stop (#F025) is eastbound on the 749 block of W Washington adjacent Park View,43.066066,-89.396121,MTS,CMAD,0,,2,90,1,W Washington,749,Park View
530,F030,Fish Hatchery at Cedar,This flag stop (#F030) is southbound on the 1336 block of Fish Hatchery after Cedar,43.051913,-89.399261,MTS,CMAD,0,,1,180,1,Fish Hatchery,1336,Cedar
633,F033,W Washington at S Park,This flag stop (#F033) is eastbound on the 899 block of W Washington after S Park,43.063327,-89.399985,MTS,CMAD,0,,1,90,1,W Washington,899,S Park
560,F056,Buick at Taft,This flag stop (#F056) is westbound on the 700 block of Buick before Taft,43.04184,-89.392935,MTS,CMAD,0,,3,270,0,Buick,700,Taft
170,F060,Fish Hatchery at Catalpa,This flag stop (#F060) is southbound on the 2198 block of Fish Hatchery before Catalpa,43.041645,-89.404114,MTS,CMAD,0,,3,180,1,Fish Hatchery,2198,Catalpa
266,F066,Fish Hatchery at S Park,This flag stop (#F066) is southbound on the 1000 block of Fish Hatchery after S Park,43.056496,-89.399124,MTS,CMAD,0,,1,180,1,Fish Hatchery,1000,S Park
770,F070,W Washington at Brittingham,This flag stop (#F070) is westbound on the 750 block of W Washington adjacent Brittingham,43.065055,-89.39822,MTS,CMAD,0,,2,270,1,W Washington,750,Brittingham
2201,F201,Regent at S Whitney,This flag stop (#F201) is eastbound on the 5199 block of Regent after S Whitney,43.067897,-89.467949,MTS,CMAD,0,,1,90,1,Regent,5199,S Whitney
2802,F202,Eau Claire at Sheboygan,This flag stop (#F202) is southbound on the 498 block of Eau Claire after Sheboygan,43.072625,-89.464236,MTS,CMAD,0,,1,180,0,Eau Claire,498,Sheboygan
2812,F212,N Midvale at University,This flag stop (#F212) is southbound on the 798 block of N Midvale after University,43.074804,-89.451399,MTS,CMAD,0,,1,180,1,N Midvale,798,University
2138,F218,Regent at Eau Claire,This flag stop (#F218) is westbound on the 5000 block of Regent after Eau Claire,43.069017,-89.463666,MTS,CMAD,0,,1,270,1,Regent,5000,Eau Claire
2121,F221,Eau Claire at Regent,This flag stop (#F221) is northbound on the 1 block of Eau Claire after Regent,43.069331,-89.463074,MTS,CMAD,0,,1,0,1,Eau Claire,1,Regent
2634,F234,S Midvale at Odana,This flag stop (#F234) is southbound on the 700 block of S Midvale after Odana,43.049826,-89.451351,MTS,CMAD,0,,1,180,1,S Midvale,700,Odana
2337,F237,N Midvale at Regent,This flag stop (#F237) is northbound on the 201 block of N Midvale after Regent,43.068501,-89.45089,MTS,CMAD,0,,1,0,0,N Midvale,201,Regent
2741,F241,N Midvale at Heather,This flag stop (#F241) is northbound on the 501 block of N Midvale after Heather,43.071626,-89.450903,MTS,CMAD,0,,1,0,1,N Midvale,501,Heather
2647,F247,Mineral Point at S Segoe,This flag stop (#F247) is eastbound on the 4799 block of Mineral Point after S Segoe,43.060773,-89.457046,MTS,CMAD,0,,1,90,1,Mineral Point,4799,S Segoe
2350,F250,Old Middleton at S Highlands,This flag stop (#F250) is southbound on the 5701 block of Old Middleton before S Highlands,43.07783,-89.479893,MTS,CMAD,0,,3,180,1,Old Middleton,5701,S Highlands
2360,F260,Old Middleton at N Highlands,This flag stop (#F260) is southbound on the 5801 block of Old Middleton before N Highlands,43.080049,-89.480883,MTS,CMAD,0,,3,180,1,Old Middleton,5801,N Highlands
2362,F262,N Midvale at Hilldale Row,This flag stop (#F262) is southbound on the 598 block of N Midvale adjacent Hilldale Row,43.072422,-89.45141,MTS,CMAD,0,,2,180,1,N Midvale,598,Hilldale Row
2764,F264,Capital at Old Middleton,This flag stop (#F264) is westbound on the 1600 block of Capital before Old Middleton,43.082627,-89.482206,MTS,CMAD,0,,3,270,1,Capital,1600,Old Middleton
2638,F268,Mineral Point at S Midvale,This flag stop (#F268) is westbound on the 4400 block of Mineral Point after S Midvale,43.060945,-89.451652,MTS,CMAD,0,,1,270,1,Mineral Point,4400,S Midvale
2472,F272,Mineral Point at Robin,This flag stop (#F272) is westbound on the 4600 block of Mineral Point after Robin,43.060962,-89.454466,MTS,CMAD,0,,1,270,1,Mineral Point,4600,Robin
2975,F275,Mineral Point at Robin,This flag stop (#F275) is eastbound on the 4601 block of Mineral Point before Robin,43.060747,-89.454281,MTS,CMAD,0,,3,90,1,Mineral Point,4601,Robin
2986,F286,Capital at University,This flag stop (#F286) is westbound on the 1698 block of Capital after University,43.084232,-89.478047,MTS,CMAD,0,,1,270,1,Capital,1698,University
2194,F294,N Midvale at Regent,This flag stop (#F294) is southbound on the 200 block of N Midvale before Regent,43.068403,-89.451371,MTS,CMAD,0,,3,180,0,N Midvale,200,Regent
3100,F300,Lake Point at Weber,This flag stop (#F300) is westbound on the 1798 block of Lake Point before Weber,43.048247,-89.344509,MTS,CMAD,0,,3,270,1,Lake Point,1798,Weber
3101,F311,Lake Point at Weber,This flag stop (#F311) is eastbound on the 1801 block of Lake Point before Weber,43.048033,-89.344879,MTS,CMAD,0,,3,90,0,Lake Point,1801,Weber
3216,F316,Lake Point at Hoboken,This flag stop (#F316) is westbound on the 1998 block of Lake Point before Hoboken,43.048357,-89.347297,MTS,CMAD,0,,3,270,1,Lake Point,1998,Hoboken
3419,F319,Lake Point at Hoboken,This flag stop (#F319) is eastbound on the 1999 block of Lake Point after Hoboken,43.048142,-89.347113,MTS,CMAD,0,,1,90,1,Lake Point,1999,Hoboken
3620,F320,Marsh at Voges,This flag stop (#F320) is southbound on the 4000 block of Marsh after Voges,43.040483,-89.286944,MTS,CMAD,0,,1,180,0,Marsh,4000,Voges
3323,F323,Lake Point at Bridge,This flag stop (#F323) is eastbound on the 1501 block of Lake Point before Bridge,43.048146,-89.33956,MTS,CMAD,0,,3,90,1,Lake Point,1501,Bridge
3311,F331,Freese at Siggelkow,This flag stop (#F331) is northbound on the 4821 block of Freese after Siggelkow,43.026762,-89.289833,MTS,CMAD,0,,1,0,0,Freese,4821,Siggelkow
3438,F338,Frazier at W Broadway,This flag stop (#F338) is westbound on the 2400 block of Frazier after W Broadway,43.047339,-89.352716,MTS,CMAD,0,,1,270,0,Frazier,2400,W Broadway
3740,F340,Marsh at Yesterday,This flag stop (#F340) is southbound on the 4300 block of Marsh after Yesterday,43.035434,-89.286892,MTS,CMAD,0,,1,180,1,Marsh,4300,Yesterday
3555,F355,Lake Point at Fayette,This flag stop (#F355) is eastbound on the 2299 block of Lake Point after Fayette,43.048171,-89.350901,MTS,CMAD,0,,1,90,0,Lake Point,2299,Fayette
3712,F372,Lake Point at Fayette,This flag stop (#F372) is westbound on the 2298 block of Lake Point before Fayette,43.048386,-89.351086,MTS,CMAD,0,,3,270,0,Lake Point,2298,Fayette
3273,F373,Valor at Star Spangled,This flag stop (#F373) is northbound on the 4801 block of Valor before Star Spangled,43.027475,-89.295285,MTS,CMAD,0,,3,0,0,Valor,4801,Star Spangled
3487,F387,Valor at Eagles Perch,This flag stop (#F387) is northbound on the 4601 block of Valor before Eagles Perch,43.031996,-89.294943,MTS,CMAD,0,,3,0,0,Valor,4601,Eagles Perch
3592,F392,Brandenburg at Freese,This flag stop (#F392) is westbound on the 5198 block of Brandenburg after Freese,43.028797,-89.291914,MTS,CMAD,0,,1,270,0,Brandenburg,5198,Freese
3196,F396,Lake Point at Bridge,This flag stop (#F396) is westbound on the 1500 block of Lake Point after Bridge,43.048415,-89.339683,MTS,CMAD,0,,1,270,1,Lake Point,1500,Bridge
4914,F414,Grandview at Sandwood,This flag stop (#F414) is southbound on the 3298 block of Grandview before Sandwood,43.026982,-89.431505,MTS,CMAD,0,,3,180,1,Grandview,3298,Sandwood
4437,F437,Verona E at Red Arrow,This flag stop (#F437) is northbound on the 4701 block of Verona E before Red Arrow,43.032331,-89.457994,MTS,CMAD,0,,3,0,1,Verona E,4701,Red Arrow
4342,F442,S Midvale at Cherokee,This flag stop (#F442) is southbound on the 1000 block of S Midvale after Cherokee,43.042198,-89.451385,MTS,CMAD,0,,1,180,1,S Midvale,1000,Cherokee
4643,F443,S Whitney at Kroncke,This flag stop (#F443) is northbound on the 2301 block of S Whitney before Kroncke,43.027545,-89.475115,MTS,CMAD,0,,3,0,1,S Whitney,2301,Kroncke
4945,F445,Post at Todd,This flag stop (#F445) is eastbound on the 2801 block of Post before Todd,43.026741,-89.426126,MTS,CMAD,0,,3,90,1,Post,2801,Todd
4849,F449,Allied at Jenewein,This flag stop (#F449) is northbound on the 2299 block of Allied after Jenewein,43.029233,-89.459201,MTS,CMAD,0,,1,0,1,Allied,2299,Jenewein
4551,F451,S Midvale at Cherokee,This flag stop (#F451) is northbound on the 1001 block of S Midvale before Cherokee,43.042324,-89.450879,MTS,CMAD,0,,3,0,1,S Midvale,1001,Cherokee
4953,F453,Post at Coho,This flag stop (#F453) is eastbound on the 1999 block of Post after Coho,43.026767,-89.414579,MTS,CFIT,0,,1,90,1,Post,1999,Coho
4654,F454,S Whitney at Kroncke,This flag stop (#F454) is southbound on the 2298 block of S Whitney before Kroncke,43.027876,-89.475596,MTS,CMAD,0,,3,180,1,S Whitney,2298,Kroncke
4355,F455,S Midvale at Nakoma,This flag stop (#F455) is northbound on the 1299 block of S Midvale after Nakoma,43.039307,-89.450853,MTS,CMAD,0,,1,0,1,S Midvale,1299,Nakoma
4360,F460,Grandview at Beltline S,This flag stop (#F460) is southbound on the 2800 block of Grandview after Beltline S,43.03486,-89.43369,MTS,CMAD,0,,1,180,0,Grandview,2800,Beltline S
4663,F463,Allied at Thurston,This flag stop (#F463) is northbound on the 2101 block of Allied before Thurston,43.031167,-89.458882,MTS,CMAD,0,,3,0,1,Allied,2101,Thurston
4466,F466,Grandview at Kingston,This flag stop (#F466) is southbound on the 3100 block of Grandview after Kingston,43.029686,-89.431851,MTS,CMAD,0,,1,180,1,Grandview,3100,Kingston
4182,F482,High Ridge at Cahill,This flag stop (#F482) is westbound on the 2200 block of High Ridge after Cahill,43.022023,-89.419045,MTS,CFIT,0,,1,270,0,High Ridge,2200,Cahill
4788,F488,Royal Wulff at High Ridge,This flag stop (#F488) is southbound on the 3098 block of Royal Wulff after High Ridge,43.021226,-89.421599,MTS,CFIT,0,,1,180,0,Royal Wulff,3098,High Ridge
5901,F501,Kennedy at Havey,This flag stop (#F501) is northbound on the 4201 block of Kennedy before Havey,43.140931,-89.387887,MTS,CMAD,0,,3,0,0,Kennedy,4201,Havey
