stop_id,stop_code,stop_name,stop_desc,stop_lat,stop_lon,agency_id,jurisdiction_id,location_type,parent_station,relative_position,cardinal_direction,wheelchair_boarding,primary_street,address_range,cross_location
435,0435,W Johnson at N Lake,This stop (#0435) is eastbound on the 699 block of W Johnson after N Lake,43.071921,-89.397094,MMT,CMAD,0,,1,90,1,W Johnson,699,N Lake
670,0670,University at N Lake,This stop (#0670) is westbound on the 700 block of University after N Lake,43.073336,-89.397994,MMT,CMAD,0,,1,270,1,University,700,N Lake
1107,1107,E Washington at S Second,This stop (#1107) is eastbound on the 1999 block of E Washington before S Second,43.09369,-89.35699,MMT,CMAD,0,,3,90,1,E Washington,1999,S Second
1164,1164,E Washington at Aberg,This stop (#1164) is westbound on the 3098 block of E Washington after Aberg,43.106465,-89.340021,MMT,CMAD,0,,1,270,1,E Washington,3098,Aberg
1233,1233,E Washington at S Sixth,This stop (#1233) is eastbound on the 2401 block of E Washington after S Sixth,43.098458,-89.350651,MMT,CMAD,0,,1,90,1,E Washington,2401,S Sixth
1323,1323,E Washington at S Webster,This stop (#1323) is eastbound on the 201 block of E Washington after S Webster,43.076331,-89.381475,MMT,CMAD,0,,1,90,1,E Washington,201,S Webster
1382,1382,E Washington at N Second,This stop (#1382) is westbound on the 1998 block of E Washington after N Second,43.093851,-89.357484,MMT,CMAD,0,,1,270,1,E Washington,1998,N Second
1412,1412,E Washington at Yahara,This stop (#1412) is westbound on the 1850 block of E Washington adjacent Yahara River,43.090111,-89.3626,MMT,CMAD,0,,2,270,1,E Washington,1850,Yahara
1513,1513,E Washington at Yahara,This stop (#1513) is eastbound on the 1851 block of E Washington adjacent Yahara River,43.089771,-89.362415,MMT,CMAD,0,,2,90,1,E Washington,1851,Yahara
1618,1618,E Washington at N Webster,This stop (#1618) is westbound on the 198 block of E Washington after N Webster,43.076009,-89.382488,MMT,CMAD,0,,1,270,1,E Washington,198,N Webster
1757,1757,E Washington at Aberg,This stop (#1757) is eastbound on the 3099 block of E Washington before Aberg,43.106375,-89.339477,MMT,CMAD,0,,3,90,1,E Washington,3099,Aberg
1846,1846,E Washington at N Sixth,This stop (#1846) is westbound on the 2398 block of E Washington after N Sixth,43.098298,-89.351552,MMT,CMAD,0,,1,270,1,E Washington,2398,N Sixth
2249,2249,S Whitney at South Hill,This stop (#2249) is northbound on the 299 block of S Whitney after South Hill,43.06409,-89.471242,MMT,CMAD,0,,1,0,1,S Whitney,299,South Hill
2266,2266,University at N Blackhawk,This stop (#2266) is westbound on the 3500 block of University after N Blackhawk,43.07544,-89.447041,MMT,VSHO,0,,1,270,1,University,3500,N Blackhawk
2282,2282,Sheboygan at N Whitney,This stop (#2282) is westbound on the 5098 block of Sheboygan before N Whitney,43.073197,-89.467211,MMT,CMAD,0,,3,270,1,Sheboygan,5098,N Whitney
2392,2392,University at Capital,This stop (#2392) is southbound on the 5601 block of University before Capital,43.08442,-89.477948,MMT,CMAD,0,,3,180,1,University,5601,Capital
2397,2397,Sheboygan at N Whitney,This stop (#2397) is eastbound on the 5099 block of Sheboygan after N Whitney,43.072937,-89.467125,MMT,CMAD,0,,1,90,1,Sheboygan,5099,N Whitney
2567,F267,N Rosa at Old Middleton,This flag stop (#F267) is northbound on the 699 block of N Rosa before Old Middleton,43.07476,-89.477842,MTS,CMAD,0,,3,0,1,N Rosa,699,Old Middleton
2595,2595,University at Shorewood,This stop (#2595) is eastbound on the 3301 block of University before Shorewood,43.075065,-89.444016,MMT,CMAD,0,,3,90,1,University,3301,Shorewood
2684,2684,S Whitney at South Hill,This stop (#2684) is southbound on the 300 block of S Whitney after South Hill,43.063786,-89.472032,MMT,CMAD,0,,1,180,1,S Whitney,300,South Hill
2755,2755,University at N Blackhawk,This stop (#2755) is eastbound on the 3501 block of University before N Blackhawk,43.075091,-89.446856,MMT,CMAD,0,,3,90,1,University,3501,N Blackhawk
6129,6129,Mineral Point at Yellowstone,This stop (#6129) is eastbound on the 6499 block of Mineral Point after S Yellowstone,43.060626,-89.491531,MMT,CMAD,0,,1,90,1,Mineral Point,6499,Yellowstone
6205,6205,Allen at Century,This stop (#6205) is northbound on the 2601 block of Allen before Century,43.103486,-89.486077,MMT,CMID,0,,3,0,0,Allen,2601,Century
6349,6349,Mineral Point at D'Onofrio,This stop (#6349) is eastbound on the 7499 block of Mineral Point after D'Onofrio,43.060416,-89.512266,MMT,CMAD,0,,1,90,1,Mineral Point,7499,D'Onofrio
6516,6516,Mineral Point at Yellowstone,This stop (#6516) is westbound on the 6500 block of Mineral Point after S Yellowstone,43.060966,-89.492358,MMT,CMAD,0,,1,270,1,Mineral Point,6500,Yellowstone
6627,6627,Century at Park,This stop (#6627) is eastbound on the 7001 block of Century before Park,43.108993,-89.501953,MMT,CMID,0,,3,90,1,Century,7001,Park
6984,6984,Mineral Point at D'Onofrio,This stop (#6984) is westbound on the 7500 block of Mineral Point after D'Onofrio,43.060765,-89.513093,MMT,CMAD,0,,1,270,1,Mineral Point,7500,D'Onofrio
7752,F752,S Sprecher at Dominion,This flag stop (#F752) is southbound on the 500 block of S Sprecher after Dominion,43.09133,-89.266963,MTS,CMAD,0,,1,180,0,S Sprecher,500,Dominion
9133,F933,E Washington at Reindahl,This flag stop (#F933) is eastbound on the 3499 block of E Washington before Reindahl,43.114104,-89.328573,MTS,CMAD,0,,3,90,1,E Washington,3499,Reindahl
9135,9135,E Washington at Lexington,This stop (#9135) is eastbound on the 3245 block of E Washington after Lexington,43.111081,-89.332975,MMT,CMAD,0,,1,90,1,E Washington,3245,Lexington
9172,9172,E Washington at Lexington,This stop (#9172) is westbound on the 3300 block of E Washington after Lexington,43.110679,-89.334198,MMT,CMAD,0,,1,270,1,E Washington,3300,Lexington
9200,9200,Anderson at Madison College,This stop (#9200) is westbound on the 3550 block of Anderson adjacent Madison College,43.121077,-89.326291,MMT,CMAD,0,,2,270,1,Anderson,3550,Madison College
9201,9201,Anderson at Madison College,This stop (#9201) is eastbound on the 3551 block of Anderson opposite Madison College,43.120826,-89.326378,MMT,CMAD,0,,4,90,1,Anderson,3551,Madison College
9344,F944,E Washington at Reindahl,This flag stop (#F944) is westbound on the 3498 block of E Washington after Reindahl,43.114292,-89.329055,MTS,CMAD,0,,1,270,1,E Washington,3498,Reindahl
9491,9491,E Washington at Lien,This stop (#9491) is eastbound on the 3901 block of E Washington after Lien,43.121383,-89.317433,MMT,CMAD,0,,1,90,1,E Washington,3901,Lien
9551,9551,E Washington at Macarthur,This stop (#9551) is eastbound on the 3701 block of E Washington after MacArthur,43.11743,-89.323306,MMT,CMAD,0,,1,90,1,E Washington,3701,MacArthur
9675,9675,Anderson at Wright,This stop (#9675) is eastbound on the 3401 block of Anderson after Wright,43.120032,-89.330072,MMT,CMAD,0,,1,90,1,Anderson,3401,Wright
9874,9874,E Washington at Macarthur,This stop (#9874) is westbound on the 3700 block of E Washington before MacArthur,43.117655,-89.323788,MMT,CMAD,0,,3,270,1,E Washington,3700,MacArthur
9984,9984,E Washington at Lien,This stop (#9984) is westbound on the 3898 block of E Washington after Lien,43.12125,-89.318323,MMT,CMAD,0,,1,270,1,E Washington,3898,Lien
12274,W274,Edgehill at Lake Mendota,This flag stop (#W274) is southbound on the 3498 block of Edgehill before Lake Mendota,43.083031,-89.451451,MTS,VSHO,0,,3,180,0,Edgehill,3498,Lake Mendota
12281,W281,Edgehill at Edgehill,This flag stop (#W281) is eastbound on the 1598 block of Edgehill before Edgehill,43.083739,-89.449044,MTS,VSHO,0,,3,90,0,Edgehill,1598,Edgehill
12283,W283,Edgehill at Oxford,This flag stop (#W283) is eastbound on the 1300 block of Edgehill before Oxford,43.081931,-89.445895,MTS,VSHO,0,,3,90,0,Edgehill,1300,Oxford
17750,L750,S Sprecher at Kilpatrick,This flag stop (#L750) is southbound on the 798 block of S Sprecher before Kilpatrick,43.085842,-89.266976,MTS,CMAD,0,,3,180,0,S Sprecher,798,Kilpatrick
141,0141,W Washington at S Fairchild,This EVENT/DETOUR ONLY stop (#0141) is eastbound on the 201 block of W Washington before of S Fairchild,43.073074,-89.386255,MMT,CMAD,0,,3,90,1,W Washington,201,S Fairchild
341,0341,N Park at W Johnson,This EVENT/DETOUR ONLY stop (#0341) is northbound on the 301 block of N Park after W Johnson,43.072352,-89.400476,MMT,CMAD,0,,1,0,1,N Park,301,W Johnson
1110,1110,E Dayton at Wisconsin,This EVENT/DETOUR ONLY stop (#1110) is westbound on the 2 block of E Dayton before of Wisconsin,43.076428,-89.385920,MMT,CMAD,0,,3,270,1,E Dayton,2,Wisconsin
1155,1155,S Webster at E Main,This EVENT/DETOUR ONLY stop (#1155) is northbound on the 99 block of S Webster after of E Main,43.075579,-89.381192,MMT,CMAD,0,,1,0,1,S Webster,99,E Main
4000,SoTP,South Transfer,South Transfer is located at 2430 S Park - just north of W Badger,43.038957,-89.394651,MMT,MTSM,1,,5,,1,S Park,2430,South Transfer
4100,4100,South Transfer,This stop (#4100) is on the pedestrian island at the South Transfer,43.038895,-89.394824,MMT,MTSM,0,4000,5,,1,S Park,2430,South Transfer
5,0005,W Dayton at N Orchard,This stop (#0005) is eastbound on the 1299 block of W Dayton after N Orchard,43.070947,-89.406982,MMT,CMAD,0,,1,90,1,W Dayton,1299,N Orchard
10,0010,Langdon at N Park,This stop (#0010) is westbound on the 898 block of Langdon before N Park,43.075933,-89.400154,MMT,CMAD,0,,3,270,1,Langdon,898,N Park
25,0025,Langdon at N Lake,This stop (#0025) is eastbound on the 699 block of Langdon after N Lake,43.075691,-89.396944,MMT,CMAD,0,,1,90,1,Langdon,699,N Lake
39,0039,N Lake at W Johnson,This stop (#0039) is northbound on the 299 block of N Lake before W Johnson,43.071895,-89.397341,MMT,CMAD,0,,3,0,1,N Lake,299,W Johnson
45,0045,Langdon at Wisconsin,This stop (#0045) is eastbound on the 1 block of Langdon before Wisconsin,43.078482,-89.38982,MMT,CMAD,0,,3,90,1,Langdon,1,Wisconsin
49,0049,N Lake at Langdon,This stop (#0049) is northbound on the 599 block of N Lake before Langdon,43.075529,-89.397191,MMT,CMAD,0,,3,0,1,N Lake,599,Langdon
52,0052,Observatory at N Charter,This stop (#0052) is westbound on the 1198 block of Observatory before N Charter,43.076131,-89.40566,MMT,UWIS,0,,3,270,1,Observatory,1198,N Charter
56,0056,Observatory at Liz Waters,This stop (#0056) is westbound on the 1300 block of Observatory adjacent Liz Waters,43.07665,-89.407141,MMT,UWIS,0,,2,270,1,Observatory,1300,Liz Waters
60,0060,Observatory at Bascom,This stop (#0060) is westbound on the 1100 block of Observatory adjacent Bascom,43.075996,-89.40366,MMT,UWIS,0,,2,270,1,Observatory,1100,Bascom
61,0061,W Dayton at N Mills,This stop (#0061) is eastbound on the 1099 block of W Dayton after N Mills,43.070893,-89.403698,MMT,CMAD,0,,1,90,1,W Dayton,1099,N Mills
68,0068,N Lake at W Johnson,This stop (#0068) is southbound on the 300 block of N Lake before W Johnson,43.072172,-89.397625,MMT,CMAD,0,,3,180,1,N Lake,300,W Johnson
75,0075,W Dayton at N Park,This stop (#0075) is eastbound on the 899 block of W Dayton after N Park,43.070839,-89.40002,MMT,CMAD,0,,1,90,1,W Dayton,899,N Park
87,0087,N Broom at W Gorham,This stop (#0087) is northbound on the 399 block of N Broom before W Gorham,43.07415,-89.392328,MMT,CMAD,0,,3,0,1,N Broom,399,W Gorham
89,0089,Langdon at N Henry,This stop (#0089) is eastbound on the 199 block of Langdon after N Henry,43.076844,-89.392142,MMT,CMAD,0,,1,90,1,Langdon,199,N Henry
96,0096,Wisconsin at W Gorham,This stop (#0096) is southbound on the 400 block of Wisconsin before W Gorham,43.077515,-89.388055,MMT,CMAD,0,,3,180,1,Wisconsin,400,W Gorham
99,0099,Langdon at N Park,This stop (#0099) is eastbound on the 899 block of Langdon after N Park,43.075745,-89.400179,MMT,CMAD,0,,1,90,1,Langdon,899,N Park
100,0100,University at N Park,This stop (#0100) is westbound on the 900 block of University after N Park,43.073399,-89.401365,MMT,CMAD,0,,1,270,1,University,900,N Park
107,0107,S Park at W Olin,This stop (#0107) is northbound on the 1117 block of S Park after W Olin,43.054383,-89.396533,MMT,CMAD,0,,1,0,1,S Park,1117,W Olin
115,0115,N Park at Regent,This stop (#0115) is northbound on the 21 block of N Park after Regent,43.067983,-89.400724,MMT,CMAD,0,,1,0,1,N Park,21,Regent
120,0120,S Park at Wingra,This stop (#0120) is southbound on the 1698 block of S Park before Wingra,43.049369,-89.394301,MMT,CMAD,0,,3,180,0,S Park,1698,Wingra
121,0121,W Badger at Fiedler,This stop (#0121) is eastbound on the 1099 block of W Badger after Fiedler,43.038466,-89.401117,MMT,CMAD,0,,1,90,1,W Badger,1099,Fiedler
133,0133,University at N Breese,This stop (#0133) is eastbound on the 1599 block of University after N Breese,43.073275,-89.413154,MMT,CMAD,0,,1,90,1,University,1599,N Breese
139,0139,N Randall at Regent,This stop (#0139) is northbound on the 1 block of N Randall after Regent,43.068038,-89.408834,MMT,CMAD,0,,1,0,1,N Randall,1,Regent
144,0144,W Badger at Colonial Heights,This stop (#0144) is westbound on the 640 block of W Badger adjacent Colonial Heights,43.038545,-89.390641,MMT,CMAD,0,,2,270,1,W Badger,640,Colonial Heights
145,0145,W Johnson at State,This stop (#0145) is eastbound on the 199 block of W Johnson after State,43.07491,-89.389575,MMT,CMAD,0,,1,90,1,W Johnson,199,State
146,0146,Fish Hatchery at Midland,This stop (#0146) is southbound on the 1200 block of Fish Hatchery after Midland,43.053981,-89.399186,MMT,CMAD,0,,1,180,1,Fish Hatchery,1200,Midland
147,0147,W Olin at Hickory,This stop (#0147) is eastbound on the 599 block of W Olin after Hickory,43.053872,-89.391782,MMT,CMAD,0,,1,90,1,W Olin,599,Hickory
153,0153,E Olin at Quann,This stop (#0153) is eastbound on the 199 block of E Olin after Quann,43.052132,-89.38075,MMT,CMAD,0,,1,90,1,E Olin,199,Quann
160,0160,University at N Randall,This stop (#0160) is westbound on the 1400 block of University after N Randall,43.073481,-89.409413,MMT,CMAD,0,,1,270,1,University,1400,N Randall
161,0161,S Broom at W Doty,This stop (#0161) is northbound on the 199 block of S Broom after W Doty,43.070146,-89.387071,MMT,CMAD,0,,1,0,1,S Broom,199,W Doty
162,0162,S Park at Meriter,This stop (#0162) is southbound on the 100 block of S Park adjacent Meriter,43.065091,-89.400997,MMT,CMAD,0,,2,180,1,S Park,100,Meriter
166,0166,Rimrock at John Nolen,This stop (#0166) is westbound on the 2000 block of Rimrock after John Nolen,43.04649,-89.374805,MMT,CMAD,0,,1,270,0,Rimrock,2000,John Nolen
173,0173,W Badger at Cypress,This stop (#0173) is eastbound on the 901 block of W Badger before Cypress,43.03843,-89.397946,MMT,CMAD,0,,3,90,1,W Badger,901,Cypress
174,0174,S Park at Fish Hatchery,This stop (#0174) is southbound on the 1000 block of S Park after Fish Hatchery,43.056451,-89.398716,MMT,CMAD,0,,1,180,1,S Park,1000,Fish Hatchery
178,0178,University at N Orchard,This stop (#0178) is westbound on the 1300 block of University after N Orchard,43.073427,-89.407056,MMT,CMAD,0,,1,270,1,University,1300,N Orchard
181,0181,S Park at Cedar,This stop (#0181) is northbound on the 1399 block of S Park after Cedar,43.052252,-89.394806,MMT,CMAD,0,,1,0,1,S Park,1399,Cedar
182,0182,N Park at W Dayton,This stop (#0182) is southbound on the 198 block of N Park after W Dayton,43.070687,-89.401094,MMT,CMAD,0,,1,180,1,N Park,198,W Dayton
184,0184,Linden at Henry,This stop (#0184) is westbound on the 1498 block of Linden before Henry,43.075254,-89.410413,MMT,UWIS,0,,3,270,1,Linden,1498,Henry
195,0195,S Park at Crosswalk,This stop (#0195) is northbound on the 1801 block of S Park adjacent Crosswalk,43.04705,-89.393808,MMT,CMAD,0,,2,0,1,S Park,1801,Crosswalk
203,0203,Rimrock at E Rusk,This stop (#0203) is northbound on the 2149 block of Rimrock after E Rusk,43.043214,-89.376979,MMT,CMAD,0,,1,0,1,Rimrock,2149,E Rusk
217,0217,S Park at W Washington,This stop (#0217) is northbound on the 399 block of S Park after W Washington,43.063668,-89.400528,MMT,CMAD,0,,1,0,1,S Park,399,W Washington
222,0222,Fisher at Bram,This stop (#0222) is southbound on the 1900 block of Fisher after Bram,43.045474,-89.391946,MMT,CMAD,0,,1,180,1,Fisher,1900,Bram
226,0226,Regent at La Marisposa,This stop (#0226) is westbound on the 700 block of Regent before La Marisposa,43.067821,-89.39749,MMT,CMAD,0,,3,270,1,Regent,700,La Marisposa
234,0234,University at N Mills,This stop (#0234) is westbound on the 1098 block of University before N Mills,43.073427,-89.403883,MMT,CMAD,0,,3,270,1,University,1098,N Mills
241,0241,Monroe at S Breese,This stop (#0241) is eastbound on the 1615 block of Monroe opposite S Breese,43.066919,-89.413883,MMT,CMAD,0,,4,90,1,Monroe,1615,S Breese
243,0243,John Nolen at Rimrock,This stop (#0243) is northbound on the 698 block of John Nolen after Rimrock,43.047242,-89.374681,MMT,CMAD,0,,1,0,1,John Nolen,698,Rimrock
251,0251,S Park at Erin,This stop (#0251) is northbound on the 699 block of S Park after Erin,43.060167,-89.40053,MMT,CMAD,0,,1,0,1,S Park,699,Erin
252,0252,State at W Gorham,This stop (#0252) is westbound on the 398 block of State before W Gorham,43.07491,-89.391303,MMT,CMAD,0,,3,270,1,State,398,W Gorham
269,0269,N Brooks at W Johnson,This stop (#0269) is northbound on the 301 block of N Brooks after W Johnson,43.072388,-89.402303,MMT,CMAD,0,,1,0,1,N Brooks,301,W Johnson
271,0271,Regent at S Park,This stop (#0271) is eastbound on the 899 block of Regent after S Park,43.067544,-89.40049,MMT,CMAD,0,,1,90,1,Regent,899,S Park
273,0273,Regent at La Marisposa,This stop (#0273) is eastbound on the 701 block of Regent after La Marisposa,43.067436,-89.397367,MMT,CMAD,0,,1,90,1,Regent,701,La Marisposa
274,0274,W Washington at N Broom,This stop (#0274) is westbound on the 400 block of W Washington after N Broom,43.071248,-89.389243,MMT,CMAD,0,,1,270,1,W Washington,400,N Broom
286,0286,Drake at S Mills,This stop (#0286) is westbound on the 1100 block of Drake after S Mills,43.062173,-89.404417,MMT,CMAD,0,,1,270,0,Drake,1100,S Mills
287,0287,W Badger at Colonial Heights,This stop (#0287) is eastbound on the 633 block of W Badger opposite Colonial Heights,43.038339,-89.390839,MMT,CMAD,0,,4,90,0,W Badger,633,Colonial Heights
288,0288,S Park at Erin,This stop (#0288) is southbound on the 700 block of S Park after Erin,43.059621,-89.400999,MMT,CMAD,0,,1,180,1,S Park,700,Erin
289,0289,W Olin at Gilson,This stop (#0289) is eastbound on the 499 block of W Olin after Gilson,43.053844,-89.389869,MMT,CMAD,0,,1,90,1,W Olin,499,Gilson
298,0298,Babcock at Linden,This stop (#0298) is southbound on the 500 block of Babcock before Linden,43.07529,-89.412894,MMT,UWIS,0,,3,180,1,Babcock,500,Linden
300,0300,Erin at S Mills,This stop (#0300) is westbound on the 1098 block of Erin before S Mills,43.059989,-89.40385,MMT,CMAD,0,,3,270,1,Erin,1098,S Mills
305,0305,W Olin at Colby,This stop (#0305) is eastbound on the 101 block of W Olin after Colby,43.052912,-89.383686,MMT,CMAD,0,,1,90,1,W Olin,101,Colby
320,0320,Fisher at Dane,This stop (#0320) is southbound on the 2098 block of Fisher before Dane,43.04312,-89.392033,MMT,CMAD,0,,3,180,1,Fisher,2098,Dane
327,0327,Regent at S Mills,This stop (#0327) is eastbound on the 1099 block of Regent after S Mills,43.067598,-89.403675,MMT,CMAD,0,,1,90,1,Regent,1099,S Mills
336,0336,N Randall at Engineering,This stop (#0336) is southbound on the 298 block of N Randall after Engineering,43.072028,-89.409136,MMT,CMAD,0,,1,180,1,N Randall,298,Engineering
353,0353,W Badger at Fish Hatchery,This stop (#0353) is eastbound on the 1121 block of W Badger after Fish Hatchery,43.038494,-89.403362,MMT,CMAD,0,,1,90,1,W Badger,1121,Fish Hatchery
360,0360,S Park at W Olin,This stop (#0360) is southbound on the 1198 block of S Park before W Olin,43.054114,-89.396841,MMT,CMAD,0,,3,180,1,S Park,1198,W Olin
365,0365,S Randall at Mound,This stop (#0365) is northbound on the 201 block of S Randall before Mound,43.065164,-89.408847,MMT,CMAD,0,,3,0,0,S Randall,201,Mound
367,0367,W Olin at Lake,This stop (#0367) is eastbound on the 299 block of W Olin after Lake,43.053682,-89.386709,MMT,CMAD,0,,1,90,1,W Olin,299,Lake
379,0379,John Nolen at E Olin,This stop (#0379) is northbound on the 499 block of John Nolen after E Olin,43.051603,-89.377887,MMT,CMAD,0,,1,0,1,John Nolen,499,E Olin
391,0391,Fish Hatchery at Carver,This stop (#0391) is northbound on the 2001 block of Fish Hatchery before Carver,43.044438,-89.403805,MMT,CMAD,0,,3,0,1,Fish Hatchery,2001,Carver
398,0398,Regent at N Randall,This stop (#0398) is westbound on the 1400 block of Regent after N Randall,43.067877,-89.409353,MMT,CMAD,0,,1,270,1,Regent,1400,N Randall
405,0405,Fish Hatchery at Catalpa,This stop (#0405) is northbound on the 2199 block of Fish Hatchery after Catalpa,43.041851,-89.403818,MMT,CMAD,0,,1,0,1,Fish Hatchery,2199,Catalpa
406,0406,Regent at N Breese,This stop (#0406) is westbound on the 1600 block of Regent after N Breese,43.067931,-89.414278,MMT,CMAD,0,,1,270,1,Regent,1600,N Breese
418,0418,W Washington at N Bedford,This stop (#0418) is westbound on the 598 block of W Washington before N Bedford,43.069002,-89.392429,MMT,CMAD,0,,3,270,1,W Washington,598,N Bedford
422,0422,S Randall at Regent,This stop (#0422) is southbound on the 2 block of S Randall after Regent,43.067501,-89.409131,MMT,CMAD,0,,1,180,0,S Randall,2,Regent
438,0438,Linden at N Charter,This stop (#0438) is eastbound on the 498 block of Linden before N Charter,43.074985,-89.406401,MMT,UWIS,0,,3,90,1,Linden,498,N Charter
448,0448,Rimrock at E Rusk,This stop (#0448) is southbound on the 2150 block of Rimrock after E Rusk,43.04248,-89.377683,MMT,CMAD,0,,1,180,1,Rimrock,2150,E Rusk
454,0454,N Breese at Hoyt,This stop (#0454) is southbound on the 124 block of N Breese before Hoyt,43.070438,-89.414055,MMT,CMAD,0,,3,180,1,N Breese,124,Hoyt
455,0455,W Johnson at N Park,This stop (#0455) is eastbound on the 899 block of W Johnson after N Park,43.071967,-89.400106,MMT,CMAD,0,,1,90,1,W Johnson,899,N Park
456,0456,Fish Hatchery at Carver,This stop (#0456) is southbound on the 2000 block of Fish Hatchery after Carver,43.044304,-89.404113,MMT,CMAD,0,,1,180,1,Fish Hatchery,2000,Carver
459,0459,Erin at S Mills,This stop (#0459) is eastbound on the 1099 block of Erin after S Mills,43.059774,-89.403665,MMT,CMAD,0,,1,90,1,Erin,1099,S Mills
462,0462,W Badger at Overpass,This stop (#0462) is westbound on the 600 block of W Badger opposite Overpass,43.038517,-89.388457,MMT,CMAD,0,,4,270,1,W Badger,600,Overpass
469,0469,W Washington at Southwest,This stop (#0469) is eastbound on the 651 block of W Washington adjacent Southwest,43.067543,-89.394121,MMT,CMAD,0,,2,90,1,W Washington,651,Southwest
470,0470,N Bassett at W Dayton,This stop (#0470) is southbound on the 200 block of N Bassett before W Dayton,43.071625,-89.39286,MMT,CMAD,0,,3,180,1,N Bassett,200,W Dayton
473,0473,W Washington at S Bassett,This stop (#0473) is eastbound on the 499 block of W Washington after S Bassett,43.070228,-89.390293,MMT,CMAD,0,,1,90,1,W Washington,499,S Bassett
475,0475,S Park at Buick,This stop (#0475) is northbound on the 2201 block of S Park before Buick,43.041625,-89.393786,MMT,CMAD,0,,3,0,1,S Park,2201,Buick
480,0480,W Gorham at N Henry,This stop (#0480) is westbound on the 200 block of W Gorham after N Henry,43.075322,-89.391155,MMT,CMAD,0,,1,270,1,W Gorham,200,N Henry
488,0488,Linden at N Charter,This stop (#0488) is westbound on the 1200 block of Linden after N Charter,43.0752,-89.407339,MMT,UWIS,0,,1,270,1,Linden,1200,N Charter
490,0490,N Charter at W Johnson,This stop (#0490) is southbound on the 300 block of N Charter before W Johnson,43.072299,-89.405883,MMT,CMAD,0,,3,180,1,N Charter,300,W Johnson
492,0492,John Nolen at Lakeside,This stop (#0492) is southbound on the 300 block of John Nolen after Lakeside,43.055713,-89.381932,MMT,CMAD,0,,1,180,1,John Nolen,300,Lakeside
496,0496,Koster at Ardmore,This stop (#0496) is westbound on the 198 block of Koster before Ardmore,43.044148,-89.385493,MMT,CMAD,0,,3,270,1,Koster,198,Ardmore
499,0499,Fish Hatchery at W Badger,This stop (#0499) is northbound on the 2499 block of Fish Hatchery after W Badger,43.038914,-89.403757,MMT,CMAD,0,,1,0,1,Fish Hatchery,2499,W Badger
512,0512,W Washington at N Bassett,This stop (#0512) is westbound on the 500 block of W Washington after N Bassett,43.069986,-89.391021,MMT,CMAD,0,,1,270,1,W Washington,500,N Bassett
519,0519,S Park at Fish Hatchery,This stop (#0519) is northbound on the 999 block of S Park after Fish Hatchery,43.057212,-89.398803,MMT,CMAD,0,,1,0,1,S Park,999,Fish Hatchery
528,0528,S Bassett at W Doty,This stop (#0528) is southbound on the 200 block of S Bassett after W Doty,43.068329,-89.388553,MMT,CMAD,0,,1,180,1,S Bassett,200,W Doty
532,0532,Linden at Babcock,This stop (#0532) is westbound on the 1598 block of Linden before Babcock,43.075254,-89.412549,MMT,UWIS,0,,3,270,1,Linden,1598,Babcock
533,0533,Regent at S Breese,This stop (#0533) is eastbound on the 1599 block of Regent after S Breese,43.067725,-89.413451,MMT,CMAD,0,,1,90,1,Regent,1599,S Breese
537,0537,W Johnson at Wisconsin,This stop (#0537) is eastbound on the 1 block of W Johnson before Wisconsin,43.076691,-89.387018,MMT,CMAD,0,,3,90,1,W Johnson,1,Wisconsin
538,0538,N Park at University,This stop (#0538) is southbound on the 398 block of N Park after University,43.072701,-89.400846,MMT,CMAD,0,,1,180,1,N Park,398,University
542,0542,N Breese at University,This stop (#0542) is southbound on the 398 block of N Breese after University,43.073132,-89.414055,MMT,CMAD,0,,1,180,1,N Breese,398,University
546,0546,S Park at Regent,This stop (#0546) is southbound on the 2 block of S Park after Regent,43.067392,-89.401194,MMT,CMAD,0,,1,180,1,S Park,2,Regent
548,0548,Regent at N Mills,This stop (#0548) is westbound on the 1100 block of Regent after N Mills,43.067822,-89.404428,MMT,CMAD,0,,1,270,1,Regent,1100,N Mills
558,0558,N Bedford at W Mifflin,This stop (#0558) is southbound on the 100 block of N Bedford before W Mifflin,43.0697,-89.393799,MMT,CMAD,0,,3,180,1,N Bedford,100,W Mifflin
